{"algorithm":"sha256","contentSetSha256":"6afad41a43d50a0e88053c4d9b8e2058a2a7bb19ed8265a821528ce8a9316532","entries":[{"kind":"external-artifact","mode":"bytes","path":"artifacts/visible-reproduction.txt","sha256":"262a6785351d37e3f1256cf4f92e0173442e28ba25b1ec285a5e77160459bc5e"},{"kind":"checksum-manifest","mode":"self-canonical","path":"checksums.json","sha256":"4f0b85186a6a86613be435874ea2dc4bdb969d298d0cac40eb0f8c099362bd66"},{"kind":"bundle-file","mode":"bytes","path":"costs.json","sha256":"11e8fb729199b41a0292ccfff318c869375d98ac8c7de3a8246c8a4b4629fbe7"},{"kind":"bundle-file","mode":"bytes","path":"environment.json","sha256":"be2cafc824f46159c78252168e77f7d3da572fb8667ae2c69b56a2642765e77f"},{"kind":"bundle-file","mode":"bytes","path":"hidden-results.json","sha256":"6c162ca986aaed31a0204cd99fe45897ceb3c6b65b16649b49bbb338a70dd351"},{"kind":"bundle-file","mode":"bytes","path":"interventions.jsonl","sha256":"52af7919da9dcc0981d440bc8a1d4620eb06a0fc481bd42567410d81eda8c988"},{"kind":"bundle-file","mode":"bytes","path":"manifest.json","sha256":"e3c8c0b5751a47e80815a06ab9a93c0b810ffc2fb2eaaaa60f6782e48f88708e"},{"kind":"bundle-file","mode":"bytes","path":"repository-state.json","sha256":"36fc4789a37bc2405d13b9bba692967f924889badee29a339ec2885ea580fdf4"},{"kind":"bundle-file","mode":"bytes","path":"requirement.md","sha256":"19a6777a13dcb9ecc24df8e0bbec6e42c692e1745ffedfacd570f787db928123"},{"kind":"bundle-file","mode":"bytes","path":"reviewer-findings.json","sha256":"765fff6378115d9909f64e763aef14144d846c0d5a7197f84813224e6d0e1322"},{"kind":"revision","mode":"bytes","path":"revision.json","sha256":"ca7f2372a30357c27b8ebd67c768cc6cab359fe4525d9c64622a073bfb33c3b4"},{"kind":"bundle-file","mode":"bytes","path":"submitted.patch","sha256":"ce12a53ec49a7160357ad1b73c7e9a27b8edf6bd7252593cfd672b6f8bf7003e"},{"kind":"bundle-file","mode":"bytes","path":"summary.json","sha256":"70bb48c3800efd5a1394ddc8ce0284da5a62921b197083b57d76ffd4238bd463"},{"kind":"bundle-file","mode":"bytes","path":"trajectory.jsonl","sha256":"6ab2165f1f26e773761e28157f846faf86ea0b727c988c2393ecb99e85cdb2f5"},{"kind":"bundle-file","mode":"bytes","path":"visible-results.json","sha256":"247b694a631c8de12660eca829c003420d5d353834e4a216a900eac6973e5667"}],"schemaType":"checksums","schemaVersion":"evidence/v1"}
